<?xml version="1.0" encoding="UTF-8"?>
<!DOCTYPE pkgmetadata SYSTEM "http://www.gentoo.org/dtd/metadata.dtd">
<pkgmetadata>
	<herd>proxy-maintainers</herd>
	<maintainer>
		<email>ck+gentoobugzilla@bl4ckb0x.de</email>
		<name>Conrad Kostecki</name>
		<description>Proxy maintaine, assign bugs to him</description>
	</maintainer>
	<longdescription>TeamSpeak Server (Voice Communication Software)</longdescription>
	<use>
		<flag name="tsdns">Make use of TeamSpeak DNS.</flag>
	</use>
</pkgmetadata>
