<?xml version="1.0" encoding="UTF-8"?>
<!DOCTYPE pkgmetadata SYSTEM "http://www.gentoo.org/dtd/metadata.dtd">
<pkgmetadata>
	<herd>radio</herd>
	<maintainer>
		<email>zerochaos@gentoo.org</email>
		<name>Rick Farina</name>
	</maintainer>
	<longdescription lang="en">
</longdescription>
	<upstream>
		<remote-id type="sourceforge">hackrf</remote-id>
		<remote-id type="github">mossmann/hackrf</remote-id>
	</upstream>
</pkgmetadata>
