<?xml version="1.0" encoding="UTF-8"?>
<!DOCTYPE pkgmetadata SYSTEM "http://www.gentoo.org/dtd/metadata.dtd">
<pkgmetadata>
	<herd>proxy-maintainers</herd>
	<maintainer>
		<email>gentoobugzilla@jeltef.nl</email>
		<name>Jelte Fennema</name>
		<description>Proxied maintainer; set to assignee in all bugs</description>
	</maintainer>
	<upstream>
		<remote-id type="github">guillaumezin/nvidiabl</remote-id>
	</upstream>
</pkgmetadata>
