<?xml version="1.0" encoding="UTF-8"?>
<!DOCTYPE pkgmetadata SYSTEM "http://www.gentoo.org/dtd/metadata.dtd">
<pkgmetadata>
  <herd>openstack</herd>
  <maintainer>
    <email>prometheanfire@gentoo.org</email>
    <name>Matthew Thode</name>
  </maintainer>
  <longdescription lang="en">
  A python package that works to provide a nice set of testing utilities for the kazoo library.
  </longdescription>
  <upstream>
    <remote-id type="pypi">zake</remote-id>
    <remote-id type="github">yahoo/Zake</remote-id>
  </upstream>
</pkgmetadata>
