<?xml version="1.0" encoding="UTF-8"?>
<!DOCTYPE pkgmetadata SYSTEM "http://www.gentoo.org/dtd/metadata.dtd">
<pkgmetadata>
<herd>proxy-maintainers</herd>
<maintainer>
	<email>alex_y_xu@yahoo.ca</email>
	<name>Alex Xu</name>
	<description>proxied maintainer, please assign bugs to</description>
</maintainer>
<maintainer>
	<email>creffett@gentoo.org</email>
	<name>Chris Reffett</name>
	<description>maintainer, please CC on bugs</description>
</maintainer>
</pkgmetadata>
