<?xml version="1.0" encoding="UTF-8"?>
<!DOCTYPE pkgmetadata SYSTEM "http://www.gentoo.org/dtd/metadata.dtd">
<pkgmetadata>
	<maintainer type="project">
    <email>gstreamer@gentoo.org</email>
    <name>GStreamer package maintainers</name>
	</maintainer>
	<use>
		<flag name="ivorbis">Enable integer based vorbis decoder</flag>
		<flag name="opus">Enable opus codec support</flag>
		<flag name="pango">Enable pango GStreamer plugin</flag>
    </use>
</pkgmetadata>
