<?xml version="1.0" encoding="UTF-8"?>
<!DOCTYPE pkgmetadata SYSTEM "http://www.gentoo.org/dtd/metadata.dtd">
<pkgmetadata>
	<herd>proxy-maintainers</herd>
	<maintainer>
		<email>zlg@gentoo.org</email>
		<name>Daniel Campbell</name>
	</maintainer>
	<maintainer>
		<email>ThyArmageddon+Gentoo@Gmail.com</email>
		<name>Elijah El Lazkani</name>
	</maintainer>
	<upstream>
		<remote-id type="github">IgnorantGuru/udevil</remote-id>
	</upstream>
</pkgmetadata>
