<?xml version="1.0" encoding="UTF-8"?>
<!DOCTYPE pkgmetadata SYSTEM "http://www.gentoo.org/dtd/metadata.dtd">
<pkgmetadata>
	<herd>proxy-maintainers</herd>
	<maintainer>
		<email>bugs@bergstroem.nu</email>
		<name>Johan BergstrÃ¶m</name>
		<description>Proxied Maintainer</description>
	</maintainer>
	<upstream>
		<remote-id type="github">joyent/http-parser</remote-id>
	</upstream>
</pkgmetadata>
