<?xml version="1.0" encoding="UTF-8"?>
<!DOCTYPE pkgmetadata SYSTEM "http://www.gentoo.org/dtd/metadata.dtd">
<pkgmetadata>
	<herd>proxy-maintainers</herd>
	<maintainer>
		<email>gentoo@xayto.net</email>
		<name>Craig Inches</name>
		<description>Proxied maintainer; set to assignee in all bugs</description>
	</maintainer>
	<herd>web-apps</herd>
	<use>
		<flag name="extras">Optional Perl modules</flag>
		<flag name="modperl">Enable <pkg>www-apache/mod_perl</pkg> support</flag>
	</use>
</pkgmetadata>
