<?xml version="1.0" encoding="UTF-8"?>
<!DOCTYPE pkgmetadata SYSTEM "http://www.gentoo.org/dtd/metadata.dtd">
<pkgmetadata>
  <herd>games</herd>
  <use>
    <flag name="fluidsynth">compile with support for fluidsynth</flag>
    <flag name="mpeg2">enable mpeg2 codec for cutscenes</flag>
    <flag name="unsupported">enable unsupported and/or broken game engines (you're on your own)</flag>
  </use>
  <upstream>
    <remote-id type="sourceforge">scummvm</remote-id>
  </upstream>
</pkgmetadata>
