<?xml version="1.0" encoding="UTF-8"?>
<!DOCTYPE pkgmetadata SYSTEM "http://www.gentoo.org/dtd/metadata.dtd">
<pkgmetadata>
	<herd>qt</herd>
	<herd>kde</herd>
	<maintainer>
		<email>jkt@gentoo.org</email>
		<name>Jan Kundr√°t</name>
	</maintainer>
	<use>
		<flag name="password">Store passwords securely via <pkg>dev-libs/qtkeychain</pkg></flag>
	</use>
	<upstream>
		<remote-id type="sourceforge">trojita</remote-id>
	</upstream>
</pkgmetadata>
