<?xml version="1.0" encoding="UTF-8"?>
<!DOCTYPE pkgmetadata SYSTEM "http://www.gentoo.org/dtd/metadata.dtd">
<pkgmetadata>
  <herd>python</herd>
  <maintainer>
    <email>floppym@gentoo.org</email>
    <name>Mike Gilbert</name>
  </maintainer>
  <upstream>
    <remote-id type="pypi">tmdb3</remote-id>
    <remote-id type="github">wagnerrp/pytmdb3</remote-id>
  </upstream>
</pkgmetadata>
