<?xml version="1.0" encoding="UTF-8"?>
<!DOCTYPE pkgmetadata SYSTEM "http://www.gentoo.org/dtd/metadata.dtd">
<pkgmetadata>
  <herd>python</herd>
  <maintainer>
    <email>yac@gentoo.org</email>
    <name>Jan Matejka</name>
  </maintainer>
  <longdescription lang="en">
	</longdescription>
  <upstream>
    <remote-id type="pypi">pycnb</remote-id>
    <remote-id type="github">yaccz/pycnb</remote-id>
  </upstream>
</pkgmetadata>
