<?xml version="1.0" encoding="UTF-8"?>
<!DOCTYPE pkgmetadata SYSTEM "http://www.gentoo.org/dtd/metadata.dtd">
<pkgmetadata>
	<maintainer>
		<email>ottxor@gentoo.org</email>
		<name>Christoph Junghans</name>
	</maintainer>
	<use>
		<flag name="dragonegg">Add support for non C languages through <pkg>sys-devel/dragonegg</pkg></flag>
	</use>
	<upstream>
		<remote-id type="github">losalamos/Byfl</remote-id>
	</upstream>
</pkgmetadata>
