<?xml version="1.0" encoding="UTF-8"?>
<!DOCTYPE pkgmetadata SYSTEM "http://www.gentoo.org/dtd/metadata.dtd">
<pkgmetadata>
  <herd>php</herd>
  <herd>proxy-maintainers</herd>
  <maintainer>
    <email>olemarkus@gentoo.org</email>
  </maintainer>
  <maintainer>
	  <email>pavel@senbonzakura.eu</email>
    <description>Proxied co-maintainer, CC on all bugs</description>
  </maintainer>
  <use>
    <flag name="memcached">Use <pkg>dev-libs/libmemcached</pkg> as a storage handler</flag>
    <flag name="sqlite">Use <pkg>dev-db/sqlite</pkg> as a storage handler</flag>
  </use>
</pkgmetadata>
