<?xml version="1.0" encoding="UTF-8"?>
<!DOCTYPE pkgmetadata SYSTEM "http://www.gentoo.org/dtd/metadata.dtd">
<pkgmetadata>
  <herd>proxy-maintainers</herd>
  <maintainer>
    <email>idella4@gentoo.org</email>
  </maintainer>
  <maintainer>
    <email>hydrapolic@gmail.com</email>
    <name>Tomas Mozes</name>
    <description>Proxy maintainer and target for any bugs</description>
  </maintainer>
  <upstream>
    <remote-id type="github">gvalkov/jenkins-webapi</remote-id>
  </upstream>
</pkgmetadata>
